{
  "$schema": "http://json-schema.org/draft-07/schema#",
  "title": "Scenes Definition",
  "description": "Defines the structure for scenes.json in each video project",
  "type": "object",
  "required": ["video_title", "fps", "width", "height", "scenes"],
  "properties": {
    "video_title": {
      "type": "string",
      "description": "Title of the video, used for file naming"
    },
    "fps": {
      "type": "integer",
      "default": 30,
      "minimum": 1,
      "maximum": 120,
      "description": "Frames per second for the video"
    },
    "width": {
      "type": "integer",
      "default": 1920,
      "description": "Video width in pixels"
    },
    "height": {
      "type": "integer",
      "default": 1080,
      "description": "Video height in pixels"
    },
    "created_at": {
      "type": "string",
      "format": "date-time",
      "description": "ISO 8601 timestamp of when this file was created"
    },
    "captions_srt_path": {
      "type": ["string", "null"],
      "description": "Path to generated .srt sidecar (relative to video root or absolute)."
    },
    "style": {
      "type": ["object", "null"],
      "description": "Video-wide style metadata, authored at Step 7 alongside STYLES.md.",
      "properties": {
        "mood": {
          "type": "string",
          "enum": ["serious", "tense", "calm", "neutral", "playful", "humorous", "upbeat"]
        }
      },
      "required": ["mood"]
    },
    "scenes": {
      "type": "array",
      "uniqueItems": true,
      "items": {
        "type": "object",
        "required": ["id", "title", "script_text", "voiceover_text"],
        "properties": {
          "id": {
            "type": "integer",
            "minimum": 1,
            "description": "Scene number, 1-indexed"
          },
          "title": {
            "type": "string",
            "description": "Short descriptive title for the scene"
          },
          "script_text": {
            "type": "string",
            "description": "Full script text for context (narration + visual description)"
          },
          "voiceover_text": {
            "type": "string",
            "description": "Exact words to be spoken by the TTS voice"
          },
          "voiceover_file": {
            "type": ["string", "null"],
            "description": "Path to generated audio file, relative to video root"
          },
          "voiceover_hash": {
            "type": ["string", "null"],
            "description": "SHA-256 of (text, voice, rate, volume, pitch). Used to skip unchanged re-generation."
          },
          "sfx_hash": {
            "type": ["string", "null"],
            "description": "SHA-256 of the scene's resolved SFX/BGM state. Gates regeneration (run by generate_sfx.py)."
          },
          "target_duration_seconds": {
            "type": ["number", "null"],
            "minimum": 0,
            "description": "Estimated duration in seconds before audio generation"
          },
          "actual_duration_seconds": {
            "type": ["number", "null"],
            "minimum": 0,
            "description": "Real duration measured from generated audio file"
          },
          "actual_duration_frames": {
            "type": ["integer", "null"],
            "minimum": 0,
            "description": "Real duration in frames (actual_duration_seconds * fps)"
          },
          "render_status": {
            "type": "string",
            "enum": ["pending", "rendered", "stitched", "failed"],
            "default": "pending",
            "description": "Current render progress for this scene"
          },
          "render_hash": {
            "type": ["string", "null"],
            "description": "SHA-256 of the scene's Remotion render inputs (SceneXX.tsx + shared project sources). Gates re-render on source change (set by render_scene.py, checked by Step 9)."
          },
          "render_attempts": {
            "type": "integer",
            "minimum": 0,
            "default": 0,
            "description": "Number of times this scene has been attempted to render"
          },
          "last_render_error": {
            "type": ["string", "null"],
            "description": "Most recent render error message (cleared on success)."
          },
          "captions": {
            "type": "array",
            "description": "Per-scene caption cues for the burned-in Remotion layer or for SRT generation.",
            "items": {
              "type": "object",
              "required": ["start", "end", "text"],
              "properties": {
                "start": { "type": "number", "minimum": 0, "description": "Start time, seconds, relative to scene start" },
                "end":   { "type": "number", "minimum": 0, "description": "End time, seconds, relative to scene start" },
                "text":  { "type": "string" }
              }
            }
          },
          "scene_file": {
            "type": ["string", "null"],
            "description": "Path to rendered scene video, relative to video root"
          },
          "stitched_file": {
            "type": ["string", "null"],
            "description": "Path to stitched scene (video+audio), relative to video root"
          },
          "visual_notes": {
            "type": "string",
            "description": "Visual treatment for the scene, populated by Step 7 (Style Definition). Specifies colors, animations, layout, and elements based on the style guide."
          },
          "transition_in": {
            "type": "string",
            "enum": ["cut", "fade", "wipe", "slide"],
            "default": "cut",
            "description": "Transition style entering this scene"
          },
          "transition_out": {
            "type": "string",
            "enum": ["cut", "fade", "wipe", "slide"],
            "default": "cut",
            "description": "Transition style exiting this scene"
          },
          "mood": {
            "anyOf": [
              {"type": "null"},
              {"type": "string", "enum": ["serious", "tense", "calm", "neutral", "playful", "humorous", "upbeat"]}
            ],
            "description": "Per-scene mood override. If null, the video's top-level style.mood applies."
          },
          "beats": {
            "type": "array",
            "description": "Named timing points mirroring the scene code's animation frames (Step 8).",
            "items": {
              "type": "object",
              "required": ["name", "time"],
              "properties": {
                "name": { "type": "string", "pattern": "^[a-z][a-z0-9_]*$" },
                "time": { "type": "number", "minimum": 0, "description": "Seconds from scene start" }
              }
            }
          },
          "sfx": {
            "type": "array",
            "description": "Per-scene sound effect cues, authored at Step 8.",
            "items": { "$ref": "#/definitions/sfxCue" }
          },
          "bgm": {
            "type": ["object", "null"],
            "description": "Per-scene music bed. If null, the global config default applies (see bgm.enabled / bgm.default_track).",
            "properties": {
              "track": { "type": "string", "description": "Bed id from the sfx/ catalog (bgm section)" },
              "volume": { "type": "number", "minimum": 0.0, "maximum": 1.0, "description": "Omit to use the global bgm.default_volume." }
            },
            "required": ["track"]
          }
        }
      },
      "description": "Array of scene objects"
    },
    "total_estimated_seconds": {
      "type": "number",
      "minimum": 0,
      "description": "Sum of all target durations"
    },
    "total_actual_seconds": {
      "type": ["number", "null"],
      "minimum": 0,
      "description": "Sum of all actual durations (null until measured)"
    }
  },
  "definitions": {
    "sfxCue": {
      "type": "object",
      "required": ["sound", "when"],
      "properties": {
        "sound": {
          "type": "string",
          "description": "Sound id or alias from the sfx/ catalog (e.g. \"whoosh\", \"impact\")"
        },
        "when": {
          "description": "\"start\" | \"mid\" | \"end\" | \"beat:<name>\" | seconds from scene start",
          "anyOf": [
            { "enum": ["start", "mid", "end"] },
            { "type": "string", "pattern": "^beat:[a-z][a-z0-9_]*$" },
            { "type": "number", "minimum": 0 }
          ]
        },
        "volume": {
          "type": ["number", "null"],
          "minimum": 0.0,
          "maximum": 1.0,
          "default": null,
          "description": "0..1 gain knob. null uses the sound's default_volume from the catalog."
        },
        "fade_out": {
          "type": ["number", "null"],
          "minimum": 0.0,
          "description": "Optional explicit tail fade, seconds. Overrides the config sfx.tail_fade_seconds for this cue's end-of-video tail-trim only. Implemented in place_cue (PHASE-04 §4.4); when null, the config default applies."
        },
        "params": {
          "type": ["object", "null"],
          "default": null,
          "description": "Per-sound parameters validated against the sound's config.json at runtime (PHASE-04)."
        }
      }
    }
  }
}
