{
  "video_title": "Why the Sky is Blue",
  "fps": 30,
  "width": 1280,
  "height": 720,
  "created_at": "2025-07-02T12:00:00Z",
  "scenes": [
    {
      "id": 1,
      "title": "Hook - The Question",
      "script_text": "Opening hook that poses the question everyone wonders about.",
      "voiceover_text": "Have you ever looked up at the sky and wondered why it's blue? It turns out the answer is more fascinating than you might think.",
      "voiceover_file": "voiceover/scene-01.mp3",
      "target_duration_seconds": 10,
      "actual_duration_seconds": 7.68,
      "actual_duration_frames": 230,
      "render_status": "pending",
      "scene_file": null,
      "stitched_file": null,
      "visual_notes": "Text 'WHY IS THE SKY BLUE?' fades in over a gradient blue background. Subtle particle animation.",
      "transition_in": "fade",
      "transition_out": "cut"
    },
    {
      "id": 2,
      "title": "The Science - Rayleigh Scattering",
      "script_text": "Explains the science of Rayleigh scattering in simple terms.",
      "voiceover_text": "Sunlight contains all colors of the rainbow. When it hits Earth's atmosphere, the light scatters off tiny molecules. Shorter wavelengths like blue scatter way more than red. That scattered blue light comes at you from every direction, making the entire sky appear blue.",
      "voiceover_file": "voiceover/scene-02.mp3",
      "target_duration_seconds": 10,
      "actual_duration_seconds": 17.04,
      "actual_duration_frames": 511,
      "render_status": "pending",
      "scene_file": null,
      "stitched_file": null,
      "visual_notes": "Animated diagram showing sunlight entering atmosphere, scattering. Blue rays scatter more than red rays. Clean infographic style.",
      "transition_in": "cut",
      "transition_out": "cut"
    },
    {
      "id": 3,
      "title": "Outro - Sunset Connection",
      "script_text": "Connects the science to sunsets and wraps up.",
      "voiceover_text": "And that's also why sunsets are red. The light travels through more atmosphere, so most blue gets scattered away before it reaches your eyes. Nature's physics, happening right above your head every single day.",
      "voiceover_file": "voiceover/scene-03.mp3",
      "target_duration_seconds": 10,
      "actual_duration_seconds": 12.984,
      "actual_duration_frames": 389,
      "render_status": "pending",
      "scene_file": null,
      "stitched_file": null,
      "visual_notes": "Beautiful sunset gradient with text overlay. Fade to channel logo.",
      "transition_in": "fade",
      "transition_out": "fade"
    }
  ],
  "total_estimated_seconds": 30,
  "total_actual_seconds": 37.704
}